product_id,name,brand,price_rub,segment,category,ingredients_raw,functional_category,pH,allergens,issues
product_017,Dr.Apple-Tox Pore,Medi-Peel,4804,люкс,Пилинг-тонер (активный),"Purified water, apple extract (20%), propanediol, glycerin, niacinamide, 1,2-hexanediol, glycereth-26, butylene glycol, panthenol, xylitol glucoside, anhydroxylitol, sodium hyaluronate, xylitol, carbonated water, grape extract, melon extract, watermelon extract, aloe vera extract, cucumber extract, kiwi extract, plum extract, kakadu plum extract, persimmon leaf extract, safflower extract, coffee bean extract, Green tea extract, chestnut bark extract, sancho leaf extract, mandarin orange peel extract, fig extract, mulberry fruit extract, pomegranate extract, ginkgo extract, neem leaf extract, evening primrose extract, elm root extract, king pine leaf extract, arrowroot extract, Mugwort extract, Comfrey leaf extract, Lycopodium extract, Horsetail extract, Yellow Chaste weed extract, Seedaceae dill extract, Port marigold flower extract, Lactobacillus/Pomegranate fermented extract, Lactobacillus/Fermented soybean extract Yeast/barley seed fermentation filtrate, star anise extract, adenosine, polyglyceryl-10 laurate, polyglyceryl-4 laurate, beta-glucan, apanoteke sacrum exopolysaccharide, caprylyl/capryl Glucoside, Disodium EDTA, Pentylene Glycol, Caprylyl Glycol, EthylhexylGlycerin, Yellow No. 4, Blue No. 1, Fragrance","Пилинг (мягкий, ферментативный), пребиотический комплекс (ферментированные), гидратация, успокаивание, антиоксидация (40+ экстрактов)",~5.5 (благодаря Glycerin + буферизации),"Цветные пигменты (Yellow No. 4, Blue No. 1) — могут окрасить кожу, Mandarin Orange (фототоксичен если есть масло), Fragrance, множество растительных экстрактов (редко аллергия, но возможна)","✅ ИННОВАТИВНЫЙ СОСТАВ: 20% Apple Extract (маска!) + ферментированные комплексы (редко встречается). ✅ 40+ растительных экстрактов (спектр антиоксидантов огромен). ✅ pH ~5.5 (мягко). ✅ Большой объем (500мл) за цену (9.61₽/мл хорошо). ⚠️ МАРКЕТИНГ: ""Dr.Apple-Tox"" звучит как 30-дневный курс, но это просто тонер. ⚠️ Цветные пигменты (может окрасить кожу). ⚠️ Mandarin Orange (если эфирное масло, то фототоксично). ⚠️ 40+ экстрактов = высокий риск аллергии на что-то. 📌 ВЕРДИКТ: Интересный состав, но маркетинг-ориентирован (""Dr.Apple"", ""Miracle""). Лучше для опытных пользователей. pH мягкий, поэтому можно ежедневно."
product_018,Refresh AHA BHA Vitamin C Daily Toner,COSRX,1510,мидл,Тонер-эксфолиант,"Actinidia Chinensis (Kiwi) Fruit Extract, Hylocereus Undatus Fruit Extract, Salix Alba (Willow) Bark Water, Pyrus Malus (Apple) Fruit Water, Butylene Glycol, Niacinamide, 1,2-Hexanediol, Ethyl Hexanediol, Sodium Lactate, Water, Glycolic Acid, Allantoin, Panthenol, Adenosine, Betaine Salicylate, Ascorbyl Glucoside","Пилинг (двойной: AHA+BHA), осветление (витамин C), гидратация, успокаивание",3.0-3.5 (низкий pH для эффективности AHA),"Glycolic Acid (может раздражать), Ascorbyl Glucoside (витамин C), фруктовые экстракты (редко), Panthenol (успокаивает)","✅ ХОРОШИЙ СОСТАВ: двойной пилинг (AHA+BHA) + витамин C + Niacinamide (смягчение раздражения). ✅ Низкий pH (3.0-3.5) идеален для кислот. ✅ Фруктовые экстракты (киви, питахая) добавляют антиоксиданты. ⚠️ КРИТИЧНО: Это АКТИВНЫЙ пилинг, НЕ для ежедневного использования! Максимум 2-3x в неделю вечером. 🚨 КОНФЛИКТЫ: ❌ Нельзя в один день с Retinol, другими пилингами, витамином C отдельно. 📌 ВЕРДИКТ: Отличный продукт для жирной/проблемной кожи, опытные пользователи. НЕ для новичков, НЕ для sensitive."
product_019,AHA-BHA-PHA 30 Days Miracle Serum,Some By Mi,1414,мидл,Сыворотка с кислотами,"Water, Centella Asiatica Extract, Cetyl Ethylhexanoate, Caprylic/Capric Triglyceride, Glycerin, Olea Europaea (Olive) Fruit Oil, Propanediol, Alcohol, Butylene Glycol, 1,2-Hexanediol, Niacinamide, Melaleuca Alternifolia (Tea Tree) Leaf Water, Sodium Chloride, Citrus Paradisi (Grapefruit) Peel Oil, Citrus Aurantium Dulcis (Orange) Peel Oil, Curcuma Longa (Turmeric) Root Extract, Melia Azadirachta Leaf Extract, Ethylhexylglycerin, Melia Azadirachta Flower Extract, Disodium EDTA, Gaultheria Procumbens (Wintergreen) Leaf Extract, Xanthan Gum, Lactobionic Acid, Pelargonium Graveolens Flower Oil, Boswellia Carterii Oil, Pentylene Glycol, Corallina Officinalis Extract, Melia Azadirachta Bark Extract, Camellia Sinensis Leaf Extract, Amyris Balsamifera Bark Oil, Prunus Amygdalus Dulcis (Sweet Almond) Oil, Moringa Oleifera Seed Oil, Rosa Canina Fruit Oil, Camellia Oleifera Seed Oil, Camellia Sinensis Seed Oil, Oryza Sativa (Rice) Bran Oil, Ocimum Sanctum Leaf Extract, Limnanthes Alba (Meadowfoam) Seed Oil, Caprylyl Glyc...","Пилинг (мягкий, PHA), противовоспаление, питание (масла), антибактериальное действие, успокаивание",~4.0-4.5 (из-за Lactobionic Acid + Alcohol),"Множество эфирных масел (Grapefruit, Orange, Geranium, Wintergreen, Boswellia, Amyris) — ФОТОТОКСИЧНЫ!, Alcohol (спирт, может раздражать), Ethylhexylglycerin, Citrus масла","✅ ОТЛИЧНЫЙ СОСТАВ: PHA (мягкий пилинг), Centella (успокаивает), масла (питание). ✅ ""30 Days Miracle"" = концепция постепенного использования (не агрессивна). ⚠️ КРИТИЧНО: 20+ эфирных масел (Grapefruit, Orange, Geranium, Wintergreen) = ФОТОТОКСИЧНОСТЬ! ❌ НЕ ДЛЯ ДНЕВНОГО ИСПОЛЬЗОВАНИЯ БЕЗ SPF 50+++! ⚠️ Alcohol в составе (может раздражать). 🚨 КОНФЛИКТЫ: Нельзя с витамином C отдельно (кислотный конфликт). ⚠️ ДОРОГО (28.28₽/мл за 50мл). 📌 ВЕРДИКТ: Хороший PHA-тонер для постепенного введения кислот (отсюда ""30 Days""). Но фототоксичен! ТОЛЬКО вечер. Хорошее соотношение активных + питания."
product_020,Hydrabio Moisturising Toning Lotion,Bioderma,1735,мидл,Увлажняющий тонер,"QUA/WATER/EAU, GLYCERIN, POLYSORBATE 20, DISODIUM EDTA, NIACINAMIDE, XYLITOL, ALLANTOIN, FRUCTOOLIGOSACCHARIDES, MANNITOL, HEXYLDECANOL, SODIUM HYDROXIDE, CITRIC ACID, RHAMNOSE, PYRUS MALUS (APPLE) SEED EXTRACT, BRASSICA CAMPESTRIS (RAPESEED) STEROLS, TOCOPHEROL, CETRIMONIUM BROMIDE, FRAGRANCE (PARFUM). [BI 532]","Гидратация (пребиотики + Glycerin), успокаивание (стеролы + Niacinamide), pH-буферизация",~5.5 (благодаря Citric Acid + Sodium Hydroxide балансу),"Отсутствуют типичные раздражители (отличная гипоаллергенность!), только Fragrance (неизвестный), Polysorbate 20 (редко раздражает), Cetrimonium Bromide (консервант, мягкий)","✅ ОТЛИЧНЫЙ СОСТАВ: пребиотический комплекс (как в Bioderma Sensibio). ✅ pH идеален (5.5). ✅ Отсутствуют агрессивные консерванты. ✅ Для sensitive кожи (Bioderma специализируется на этом). ✅ Хорошее увлажнение (Glycerin + пребиотики). ⚠️ НЕ пилинг-тонер (это просто увлажняющий тонер). ⚠️ Не содержит активные кислоты (для тех, кто ищет эксфолиацию). 📌 ВЕРДИКТ: ОТЛИЧНЫЙ тонер для sensitive/воспаленной кожи. Безопасен ежедневно. Лучше, чем COSRX для sensitive."
product_021,Lotion Tonique Éclat,PAYOT,1020,мидл,Тоник/Эссенция,"Aqua, Glycerin, Butylene Glycol, Polysorbate 20, Citrus Aurantium Amara (Bitter Orange) Flower Water, Chlorphenesin, Parfum, Xanthan Gum, Sodium Hydroxide, Citric Acid, Gossypium Hirsutum Seed Extract, Tropaeolum Majus Flower/Leaf/Stem Extract, Pentylene Glycol, Sodium Benzoate, Potassium Sorbate","Увлажнение, тонизирование, освежение",~5.0-5.5 (благодаря Citric Acid + Sodium Hydroxide буферизации),"Citrus Aurantium (фототоксичен только в форме эфирного масла, здесь вода = безопасна), Chlorphenesin, Parfum","✅ ПРОСТОЙ, ЧЕСТНЫЙ СОСТАВ. ✅ pH контролируется правильно. ✅ Горькооранжевая вода (традиционный ингредиент, работает). ✅ Хорошее увлажнение (Glycerin + Butylene Glycol). ⚠️ Chlorphenesin (консервант, может раздражать при sensitive). ⚠️ Цена 5.10₽/мл разумна. 📌 ВЕРДИКТ: Хороший базовый тоник для всех типов кожи. Не маркетинг, простой и честный."
product_022,Vinoclean Moisturizing Toning Lotion,Caudalie,1012,мидл,Увлажняющий тоник,"Aqua, Butylene Glycol, Rosa Damascena Flower Water, Saccharide Isomerate, Methylpropanediol, Sodium Benzoate, Caprylyl Glycol, Citric Acid, Phenylpropanol, Sodium Carboxymethyl Beta-Glucan, Sodium Citrate","Увлажнение, успокаивание, тонизирование, легкий укрепляющий эффект",~5.0-5.5 (Citric Acid + Sodium Citrate),"Phenylpropanol (консервант, редко раздражает), Sodium Benzoate, отсутствуют типичные раздражители","✅ КАЧЕСТВЕННЫЙ СОСТАВ. ✅ Розовая вода (классическая, работает). ✅ Saccharide Isomerate (редко встречается, хороший увлажнитель). ✅ Beta-Glucan (иммуномодулятор). ⚠️ Маленький объём (100мл за 1012₽ = дорого). ⚠️ Цена 10.12₽/мл высока. 📌 ВЕРДИКТ: Люкс-тоник с хорошим составом, но дорого за объём."
product_023,Sensibio Успокаивающий тоник,Bioderma,2283,мидл,Успокаивающий тоник,"Aqua, Glycerin, Xylitol, Polysorbate 20, Mannitol, Rhamnose, Fructooligosaccharides, Cucumis Sativus (Cucumber) Fruit Extract, Peg-40 Hydrogenated Castor Oil, Allantoin, Propylene Glycol, Disodium EDTA, Cetrimonium Bromide, Sodium Hydroxide, Citric Acid","Восстановление микробиома, увлажнение, успокаивание, pH буферизация",~5.0-5.5,"Пропиленгликоль (может раздражать при sensitivity), отсутствуют типичные раздражители (нет Fragrance, очень гипоаллергенен)","✅ ОТЛИЧНЫЙ СОСТАВ. ✅ Пребиотический комплекс (как в Bioderma Sensibio очищающем). ✅ Огурец (мягко успокаивает). ✅ Allantoin (заживляет). ✅ pH правильный. ⚠️ Дорого (9.13₽/мл). ❌ Нет гиалуроната (только пребиотики для гидратации). 📌 ВЕРДИКТ: TOP для sensitive/воспаленной кожи. Лучший состав из всех тоников. Дорогой, но оправдано."
product_024,Forever Young Balancing Toner,Christina,3320,люкс,Пилинг-тоник с AHA/BHA,"Hexylene Glycol, Chlorphenesin, Caprylyl Glycol, Glycolic Acid, Lactic Acid, Sodium Hydroxide, Propylene Glycol, Fragrance, Deionized Water, Phenoxyethanol, Quillaja Saponaria Bark Extract, Saponaria Officinalis Leaf Extract, Hamamelis Virginiana Water, Polysorbate-20, Decyl Glucoside, Blue-1 (CI 42090), Yellow No. 10 (CI 47005), Red No. 33 (CI 17200)","Пилинг (AHA комбинация), очищение пор, противовоспаление","3.2-3.7 (по заявлению, очень кислое для AHA)","Glycolic Acid + Lactic Acid (раздражители!), Phenoxyethanol, цветные пигменты (могут окрашивать), Fragrance","🚨 ЭТО АКТИВНЫЙ ПИЛИНГ, НЕ ТОНИК! ✅ pH правильный для AHA (3.2-3.7). ✅ Двойной AHA (гликолевая + лактическая = мощный пилинг). ⚠️ ОЧЕНЬ раздражающий (не для ежедневного использования). ⚠️ Цветные пигменты (Blue-1, Yellow 10, Red 33) могут окрасить кожу или вызвать аллергию. ⚠️ Дорого (11.07₽/мл за активный пилинг). 📌 ВЕРДИКТ: УСЛОВНО для опытных пользователей. 2-3x в неделю вечером только. НЕ для новичков, sensitive."
product_025,Face Tonic Moisturizing,Tony Morris,774,бюджет,Тоник с AHA/BHA,"Water, Panthenol, Chlorhexidine Digluconate, Berberis Aouifolium (Mahonia Aquifolium) Extract, Rosa Centifolia Flower Extract, Camellia Sinensis (Green Tea) Leaf Extract, AHA, BHA, Citric Acid, Lactic Acid, Perfume","Увлажнение, мягкий пилинг (AHA+BHA), успокаивание, антиоксидация",~4.0-4.5 (из-за Lactic Acid + Citric Acid),"Chlorhexidine Digluconate (консервант, может раздражать), AHA+BHA (раздражители), Fragrance","⚠️ НЕПОЛНАЯ ИНФОРМАЦИЯ: AHA и BHA указаны БЕЗ INCI названия и концентраций! ⚠️ Это заявлено, но неизвестно сколько. ⚠️ Chlorhexidine Digluconate (консервант-раздражитель, часто вызывает контактный дерматит). ✅ Panthenol, Mahonia, зеленый чай хороши. 📌 ВЕРДИКТ: ПОДОЗРИТЕЛЬНО. Неполная информация о кислотах. Консервант раздражающий. Цена 3.87₽/мл низкая, но за неизвестный состав. НЕ рекомендовать без более подробной информации."
product_026,Exfoliating Toner,Krygina Cosmetics,1619,мидл,Пилинг-тоник AHA,"Water, Glycerin, Propylene Glycol, Phenoxyethanol (And) Ethylhexylglycerin, Polysorbate-20, Lactic Acid, Malic Acid, Glycolic Acid, Panthenol, Allantoin, Lotus Japonicus Extract, Hamamelis Extract, Citric Acid, Parfum","Пилинг (тройной AHA), осветление, себорегуляция",3.0-3.5 (очень кислое),"Phenoxyethanol + Ethylhexylglycerin (двойная консервация), Glycolic Acid (может раздражать), Parfum","✅ ОТЛИЧНЫЙ АХА КОМПЛЕКС (три кислоты). ✅ pH правильный (3.0-3.5 для AHA). ⚠️ ТРОИЧНЫЙ ПИЛИНГ (Лактическая + Гликолевая + Яблочная) = МОЩНЫЙ! ⚠️ Растительные экстракты минорны. 🚨 КОНФЛИКТЫ: ❌ Retinol в один день, ❌ витамин C отдельно, ❌ другие AHA/BHA. 📌 ВЕРДИКТ: Для опытных только. 2-3x в неделю вечером. Новичкам — слишком агрессивно."
product_027,AHA-Cleansing Tonic,Aravia Laboratories,750,бюджет,Пилинг-тоник AHA,"Aqua, Glycerin, Lactic Acid, Phenoxyethanol, PEG-40 Hydrogenated Castor Oil, Glycolic Acid, Ananas Sativus Fruit Extract, Citrus Limon Fruit Extract, Punica Granatum Fruit Extract, Vitis Vinifera Fruit Extract, Sodium Hydroxide, Citric Acid, Malic Acid, Hydroxyethylcellulose, Parfum, Ethylhexylglycerin","Пилинг (двойной AHA), осветление (фруктовые кислоты), гидратация",3.5-4.0 (благодаря Citric Acid + Sodium Hydroxide буферизации),"Phenoxyethanol (консервант-раздражитель), Glycolic Acid, фруктовые экстракты (редко), Parfum","✅ ХОРОШИЙ БАЛАНС: двойной AHA + фруктовые кислоты (осветление). ✅ Цена очень хорошая (3.00₽/мл). ✅ pH буферизирован правильно. ⚠️ Phenoxyethanol может раздражать sensitive. ⚠️ Лимонный/апельсиновый экстракты могут быть фототоксичны в концентрациях. 📌 ВЕРДИКТ: ОТЛИЧНОЕ соотношение цена/качество. Лучше, чем Krygina (дешевле в 5x раз). Для опытных пользователей."
product_028,Acid Key,DE_CODE,399,бюджет,Пилинг-тоник (многофункциональный),"Aqua, Glycolic Acid, Pentylene Glycol, Aloe Barbadensis Leaf Juice, Sodium Hydroxide, Gluconolactone, Mandelic Acid, Malic Acid, Citric Acid, Glycyrrhiza Glabra Rhizome/Root Extract, Panthenol, Phenoxyethanol, Ethylhexylglycerin, Potassium Sorbate, Sodium Benzoate, Parfum, Disodium EDTA, Linalool, Geraniol","Пилинг (AHA+PHA комбинация, мягкий), гидратация, успокаивание, осветление",3.5-4.0 (из-за Glycolic Acid + Citric Acid + Sodium Hydroxide буферизации),"Linalool + Geraniol (из растительных экстрактов, могут быть фототоксичны), Phenoxyethanol, Ethylhexylglycerin (двойная консервация), Parfum","✅ ОТЛИЧНЫЙ ВЫБОР: PHA (гюконолактон) + AHA = мягкий пилинг! ✅ Алоэ + солодка (успокаивают). ✅ Цена ОЧЕНЬ хорошая (2.66₽/мл). ✅ pH правильный. ⚠️ Двойная консервация (Phenoxyethanol + Ethylhexylglycerin). ⚠️ Linalool + Geraniol (фототоксичны). 📌 ВЕРДИКТ: BEST BUDGET CHOICE! PHA для начинающих, хорошая гидратация, отличная цена. Лучше Aravia (дешевле)."
product_029,Royal Caviar Anti-Age,Natura Siberica,2908,мидл,Люкс пилинг-тоник,"Aqua, Butylene Glycol, Dipropylene Glycol, Gluconolactone, Tranexamic Acid, Mandelic Acid, Lactic Acid, Glycolic Acid, Arginine, Caviar Extract, Panthenol, Aralia Mandshurica Leaf/Stem Water, Flavocetraria Nivalis Water, Codium Fragile Extract, Ahnfeltia Plicata Extract, Geranium Sibiricum Extract, Rhododendron Dauricum Flower/Leaf/Stem Extract, Bis-PEG-18 Methyl Ether Dimethyl Silane, PEG-40 Hydrogenated Castor Oil, Parfum, Benzyl Alcohol, Sodium Benzoate, Potassium Sorbate, Sodium Hydroxide","Пилинг (PHA+AHA комбинация, мягкий), осветление (Tranexamic), анти-эйдж, противовоспаление, гидратация","~4.0-4.5 (благодаря Gluconolactone (PHA, pH-буфер) + буферизации)","Benzyl Alcohol (консервант), Parfum, растительные масла из сибирских растений могут быть раздражителями","✅ ОТЛИЧНЫЙ СОСТАВ: PHA+AHA (мягкий), Tranexamic Acid (редко встречается!), сибирские растения. ✅ Tranexamic Acid помогает при пигментации и воспалении. ⚠️ Caviar Extract — маркетинг (1% = микродоза). ⚠️ Benzyl Alcohol (консервант). ⚠️ ДОРОГО (19.39₽/мл). 📌 ВЕРДИКТ: ОТЛИЧНЫЙ СОСТАВ (Tranexamic = плюс), но переплачиваешь за Caviar. Для опытных пользователей, анти-эйдж."
product_031,AHA+BHA+PHA Tonic Perfector,MASKOHOLIC,601,бюджет,Пилинг-тоник (тройной),"Deionized water, gluconolactone, propylene glycol, hydroxyethyl urea, glycerin, aloe barbadensis leaf juice, sodium hydroxide, lactic acid, glycolic acid, malic acid, mandelic acid, citric acid, PEG-40 hydrogenated castor oil, salicylic acid, phenoxyethanol, parfum","Пилинг (AHA+BHA+PHA — тройной!), гидратация, себорегуляция, осветление",3.5-4.0 (из-за лактической + гликолевой + лимонной кислот),"Phenoxyethanol (раздражитель), Parfum, множество кислот = потенциальное раздражение","🚨 ТРОЙНОЙ ПИЛИНГ (AHA+BHA+PHA)! ✅ ОЧЕНЬ ДЕШЕВО (3.01₽/мл). ✅ Алоэ + Hydroxyethyl Urea (гидратация). ✅ pH правильный. 🚨 ОЧЕНЬ ОПАСНО: Это не для новичков! Три типа пилинга одновременно = раздражение при регулярном использовании. ⚠️ Phenoxyethanol. 📌 ВЕРДИКТ: ТОЛЬКО опытные пользователи, 1-2x в неделю максимум! Не ежедневно!"
product_032,Обновляющий и выравнивающий пилинг,Siberian Health,900,бюджет,Пилинг-тоник (с эфирными маслами),"aqua (water), propanediol, gluconolactone, polysorbate 20, lactic acid, tartaric acid, glycolic acid, allantoin, salicylic acid, bisabolol, schizandra chinensis fruit extract, pogostemon cablin (patchouli) leaf oil, chlorphenesin, sodium hydroxide, parfum, ganoderma lucidum (lingzhi mushroom) extract, juniperus communis (juniper) fruit oil, cananga odorata (ylang ylang) flower oil, citrus aurantium (neroli) flower oil, citrus bergamia (bergamot) peel oil, cupressus sempervirens (cypress) leaf oil, vetiveria zizanoides (vetiver) root oil, cedrus atlantica (cedar) bark oil","Пилинг (PHA+AHA+BHA комбинация), успокаивание, противовоспаление",~3.5-4.0 (из-за лактической + гликолевой + винной кислот),"🚨 МНОЖЕСТВЕННЫЕ ФОТОТОКСИЧНЫЕ ЭФИРНЫЕ МАСЛА (Bergamot, Neroli, Citrus, Cypress, Juniper = 6+ фототоксичных масел!), Phenoxyethanol, Chlorphenesin, Tartaric Acid","✅ ХОРОШИЙ СОСТАВ: PHA+AHA+BHA, Bisabolol (успокаивает), Чага. ✅ Цена разумна (4.50₽/мл). 🚨🚨 КРИТИЧНО: 6+ ФОТОТОКСИЧНЫХ ЭФИРНЫХ МАСЕЛ! ❌ НЕ для дневного использования БЕЗ SPF 50+++! ⚠️ Тройной пилинг + фототоксичные масла = очень раздражающее для sensitive. ⚠️ Chlorphenesin может раздражать. 📌 ВЕРДИКТ: ТОЛЬКО ночной уход. Не для дневного использования! Новичкам слишком агрессивно."
