product_id,name,brand,price_rub,segment,category,ingredients_raw,functional_category,pH,allergens,issues
product_046,Birch juice moisturizing sunscreen SPF 50+,Round Lab,1448,мидл,SPF 50+ PA++++ (химический+минеральный),"Water, Dibutyl Adipate, Propanediol, Diethylamino Hydroxybenzoyl Hexyl Benzoate, Polymethylsilsesquioxane, Ethylhexyl Triazone, Niacinamide, Methylene Bis-Benzotriazolyl Tetramethylbutylphenol, Coco-Caprylate/Caprate, Caprylyl Methicone, Diethylhexyl Butamido Triazone, Glycerin, 1,2-Hexanediol, Butylene Glycol, Betula Platyphylla Japonica Juice(1,425ppm), Sodium Hyaluronate, Hyaluronic Acid, Glyceryl Glucoside, Dipotassium Glycyrrhizate, Allantoin, Portulaca Oleracea Extract, Artemisia Annua Extract, Pinus Sylvestris Leaf Oil, Anthemis Nobilis Flower Oil, Acrylates/C10-30 Alkyl Acrylate Crosspolymer, Sodium Stearoyl Glutamate, Polyacrylate Crosspolymer-6, Ethylhexylglycerin, Ascorbic Acid, Adenosine, Pentylene Glycol, Behenyl Alcohol, Poly C10-30 Alkyl Acrylate, Polyglyceryl-3 Methylglucose Distearate, Decyl Glucoside, Tromethamine, Xanthan Gum, t-Butyl Alcohol, Tocopherol, Carbomer","SPF 50+ PA++++ (широкий спектр, химический-минеральный гибрид), гидратация, осветление (витамин C), успокаивание",~5.0-5.5 (благодаря pH-буферизации),"Диethylamino Hydroxybenzoyl Hexyl Benzoate (может быть раздражителем), Ethylhexyl Triazone (может быть раздражителем), Ascorbic Acid (витамин C), Pinus Sylvestris Leaf Oil + Anthemis Flower Oil (фототоксичны, но это SPF — маскируется УФ-защитой)","✅ SPF 50+ PA++++ (хороший уровень). ✅ Химический + минеральный гибрид (хорошее решение). ✅ Витамин C (осветление при солнцезащите). ✅ Успокаивающие экстракты. ⚠️ Химические УФ-фильтры могут раздражать sensitive. 🚨 ДОРОГО (28.96₽/мл). 📌 ВЕРДИКТ: TOP для SPF 50+, но дорого. Есть дешевле варианты."
product_047,Birch juice moisturizing mask (тканевая),Round Lab,180,бюджет,Тканевая маска (одна штука),"Water, Glycerin, Methylpropanediol, Propanediol, Betula Platyphylla Japonica Juice, Hydroxyacetophenone, Carbomer, Tromethamine, Allantoin, Caffeine, Polyglyceryl-10 Laurate, Polyglyceryl-10 Myristate, Butylene Glycol, Caprylyl Glycol, Xanthan Gum, Ethylhexylglycerin, 1,2-Hexanediol, Dipotassium Glycyrrhizate, Sodium Hyaluronate, Disodium EDTA, Althaea Rosea Flower Extract, Glyceryl Caprylate","Тканевая маска для гидратации, тонизирования, успокаивания",~5.5-6.0 (благодаря pH-буферизации),"Caffeine (может раздражать при чувствительности на кофеин), Ethylhexylglycerin, Carbomer",✅ Хороший состав (Betula + Caffeine + успокаивающие). ✅ Дешево (180₽ за маску). ✅ Удобный формат. ⚠️ Caffeine может раздражать. 📌 ВЕРДИКТ: Хороший выбор для быстрой гидратации.
product_048,Birch juice moisturizing serum,Round Lab,1689,мидл,Сыворотка увлажняющая с витамином C,"Water, Methylpropanediol, Glycerin, 1,2-Hexanediol, Polyglycerin-3, Caprylic/Capric Triglyceride, Betula Platyphylla Japonica Juice(10,000ppm), Sodium Hyaluronate, Glyceryl Glucoside, Hydrolyzed Hyaluronic Acid, Butylene Glycol, Hyaluronic Acid, Ascorbic Acid, Beta-Glucan, Dipotassium Glycyrrhizate, Hydrogenated Lecithin, Ethylhexylglycerin, Eclipta Prostrata Leaf Extract, Laminaria Japonica Extract, Avena Sativa (Oat) Kernel Extract, Cynara Scolymus (Artichoke) Leaf Extract, Pteris Multifida Extract, Melia Azadirachta Leaf Extract, Melia Azadirachta Flower Extract, Coccinia Indica Fruit Extract, Aloe Barbadensis Flower Extract, Solanum Melongena (Eggplant) Fruit Extract, Ocimum Sanctum Leaf Extract, Corallina Officinalis Extract, Curcuma Longa (Turmeric) Root Extract, Cyclohexasiloxane, Dipropylene Glycol, Ammonium Acryloyldimethyltaurate/VP Copolymer, Xanthan Gum, Fructooligosaccharides, Carbomer, Disodium EDTA, Polyquaternium-51, Tromethamine, Tocopherol","Сыворотка увлажняющая, осветление (витамин C + Betula), гидратация (тройной гиалуронат), антиоксидация (множество растительных экстрактов)",~5.0-5.5 (благодаря pH-буферизации),"Ascorbic Acid (витамин C), Ethylhexylglycerin, множество растительных экстрактов (редко)","✅ ОТЛИЧНЫЙ состав: Betula Juice 1% (высокая концентрация!), Ascorbic Acid (витамин C), тройной гиалуронат. ✅ 10+ растительных экстрактов (богатый антиоксидантный комплекс). ⚠️ ОЧЕНЬ ДОРОГО (33.78₽/мл). ⚠️ Ascorbic Acid может раздражать при regula использовании. 📌 ВЕРДИКТ: TOP для осветления + гидратации, но дорого."
product_049,Xemose Face Cream,Uriage,915,бюджет,Крем для чувствительной кожи (с лактической кислотой!),"Aqua (Water, Eau), Butyrospermum Parkii (Shea) Butter, Squalane, Dicaprylyl Ether, Glycerin, Polysorbate 60, Caprylic/Capric Triglyceride, Sorbitan Stearate, 1,2-Hexanediol, Acrylates/C10-30 Alkyl Acrylate Crosspolymer, Behenyl Alcohol, Hydroxyacetophenone, Potassium Cetyl Phosphate, Shorea Stenoptera Seed Butter, Sodium Polyacrylate, Safflower Oil/Palm Oil Aminopropanediol Esters, Tocopheryl Acetate, Xanthan Gum, Sodium Hydroxide, Polyglyceryl-10 Stearate, Borage Seed Oil Aminopropanediol Amides, Triethyl Citrate, Polyglyceryl-6 Behenate, Asiaticoside, Phytosphingosine, Behenic Acid, Ceramide NP, Cetearyl Alcohol, Cholesterol, Glyceryl Stearate, Lactic Acid, Tocopherol, Ceramide NS, Ceramide EOP, Ceramide AP, Sodium Cetearyl Sulfate","Крем для чувствительной кожи, восстановление барьера (керамиды + липиды), мягкий пилинг (лактическая кислота), успокаивание (Centella), питание",~5.5-6.0 (благодаря pH-буферизации),"Sodium Cetearyl Sulfate (может быть раздражителем!), Lactic Acid (может раздражать при sensitivity), Sodium Hydroxide","✅ ОТЛИЧНЫЙ для sensitive: Керамидная триада + Cholesterol + lipids. ✅ ЛАКТИЧЕСКАЯ КИСЛОТА в креме (редко!) — мягкий пилинг + восстановление. ✅ Centella (Asiaticoside). 🚨 КРИТИЧНО: Sodium Cetearyl Sulfate (может быть раздражителем!). ⚠️ Lactic Acid + Ceramides (интересная комбинация, но редко встречается в один продукт). 📌 ВЕРДИКТ: TOP для sensitive с желанием мягкого пилинга. Но Sodium Cetearyl Sulfate рискован."
product_050,Creme riche lissante rides,PAYOT,2802,мидл,Питательный разглаживающий крем (анти-эйджинг),"Aqua (water), caprylic/capric triglyceride, butyrospermum parkii (shea) butter, glycerin, isononyl isononanoate, hydrogenated coco-glycerides, cetearyl alcohol, maltodextrin, hydroxyethyl acrylate/sodium acryloyldimethyl taurate copolymer, marrubium vulgare extract, hydrolyzed viola tricolor extract, sodium hyaluronate, jasminum officinale flower oil, (jasminum officinale (jasmine), oil), pinus cembra wood extract, parfum (fragrance), cetearyl glucoside, cellulose, sodium stearoyl glutamate, chlorphenesin, tocopheryl acetate, ethylhexylglycerin, xanthan gum, o-cymen-5-ol, polysorbate 60, sorbitan isostearate, citric acid, 1,2-hexanediol, caprylyl glycol, tocopherol","Анти-эйджинг крем, питание (Shea Oil + растительные масла), гидратация (гиалуронат), антивозраст (фиалка + мясо растение)",~5.5-6.0 (благодаря pH-буферизации Citric Acid),"Jasminum Oil (фототоксичен), O-Cymen-5-Ol (фенол, раздражитель), Ethylhexylglycerin, Chlorphenesin, Fragrance","✅ Питательный крем (Shea + масла). ✅ Фиалка (редкий компонент для морщин). 🚨 КРИТИЧНО: Jasminum Oil (фототоксичен!) — ❌ НЕ для дневного использования без SPF 50++! 🚨 O-Cymen-5-Ol (фенол-раздражитель). ⚠️ ОЧЕНЬ ДОРОГО (56.04₽/мл). 📌 ВЕРДИКТ: Люкс крем с фототоксичными компонентами. ТОЛЬКО ночь. Цена сумасшедшая за состав, который содержит раздражители."
product_051,Niacinamide 10% + Zinc 1%,ART & FACT,648,бюджет,Анти-акне сыворотка,"Aqua/Water, Niacinamide, Butylene Glycol, Zinc PCA, Propylene Glycol, Ethylhexylglycerin, Phenoxyethanol, Dimethyl Isosorbide, Xanthan Gum, Ceteareth-23, Dipropyleneglycol, Centaurea Cyanus Flower Extract, Vaccinium Vitis-Idaea Fruit Extract","Себорегуляция, противовоспаление, антиоксидация, матирование (Niacinamide + Zinc)","~6.0-6.5 (нейтральный, нет Citric Acid)","Ethylhexylglycerin, Phenoxyethanol (двойная консервация), Propylene Glycol, отсутствуют типичные раздражители","✅ ОТЛИЧНАЯ КОНЦЕНТРАЦИЯ: Ниацинамид 10% (это РАБОТАЕТ, 4-5% минимум для эффекта, 10% = мощно). ✅ Zinc PCA (себорегуляция, хорош). ✅ Простой, честный состав (ничего лишнего). ⚠️ Двойная консервация (Ethylhexylglycerin + Phenoxyethanol, может раздражать при чувствительности). ⚠️ pH ~6.0-6.5 (нейтральный, не буферизирован). ⚠️ Маленький формат (30мл, за месяц). 📌 ВЕРДИКТ: Хороший выбор для жирной/проблемной кожи (Niacinamide 10% работает отлично). Цена 21.60₽/мл разумна."
product_052,Azeloglicine 10%,ART & FACT,527,бюджет,Анти-акне сыворотка (азелаиновая кислота),"Aqua/Water, Potassium Azeloyl Diglycinate, Glycerin, Propylene Glycol, Magnezium Aspartate, Zinc Gluconate, Copper Gluconate, Ethylhexylglycerin, Phenoxyethanol, Glyceryl Stearate Citrate, Sodium PCA, Sodium Lactate, Arginine, Aspartic Acid, PCA, Glycine, Alanine, Serine, Valine, Proline, Threonine, Isoleucine, Histidine, Phenylalanine, Aloe Barbadensis Leaf Juice, Lysolecithin, Sclerotiumgum, Xanthan Gum, Pullulan, Isononyl Isononanoate, Acrylates/C10-30 Alkyl Acrylate Crosspolymer, Disodium EDTA, Panthenol, Sodium Hydroxide,  Salicylic Acid","Анти-акне (мощная), противопигментация (азелаиновая кислота), себорегуляция, пилинг мягкий (BHA), гидратация, противовоспаление",3.5-4.0 (из-за Salicylic Acid + Sodium Hydroxide буферизация),"Salicylic Acid (может раздражать), Ethylhexylglycerin + Phenoxyethanol (двойная консервация), Propylene Glycol, отсутствуют типичные раздражители","✅ МОЩНАЯ ФОРМУЛА: Азелаиновая кислота 10% (редко встречается, обычно 10-20% в креме, а здесь в сыворотке!). ✅ Salicylic Acid (BHA, добавочный пилинг). ✅ Аминокислотный комплекс (NMF для восстановления после пилинга). ✅ Гидратация (Glycerin + Aloe). ⚠️ ТРОИЧНОЕ ДЕЙСТВИЕ: Азелаиновая кислота + BHA + аминокислоты = может быть раздражающе при чувствительности. ⚠️ pH ~3.5-4.0 (кислое, нужна адаптация). ⚠️ Двойная консервация (может раздражать). 📌 ВЕРДИКТ: Это БОЕВАЯ сыворотка для серьезного акне/пигментации. Цена 17.57₽/мл справедлива. Но требует ОПЫТА."
product_053,2% BHA Cream Cleanser 31.2,andplus,700,бюджет,Очищающий гель с BHA,"Water, glycerin, cocamidopropyl betaine, cetyl alcohol, glyceryl stearate se, butylene glycol, coco-betaine, sodium methyl cocoyl taurate, salicylic acid, tromethamine, coco-glucoside, sodium chloride, hydroxyethyl acrylate/sodium acryloyldimethyl taurate copolymer, peg-120 methyl glucose dioleate, decyl glucoside, 1,2-hexanediol, caprylyl glycol, chlorella vulgaris extract, glucose, fructooligosaccharides, fructose, sodium cocoyl isethionate, sodium benzoate, sodium phytate, quillaja saponaria bark extract, citric acid, cynanchum atratum extract, ethylhexylglycerin, tocopherol, althaea rosea flower extract","Мягкое очищение, BHA пилинг (мягкий), себорегуляция, гидратация",~3.5-4.0 (благодаря Salicylic Acid + Citric Acid + Tromethamine буферизации),"Salicylic Acid (может раздражать), Ethylhexylglycerin, Sodium Benzoate, Citric Acid","✅ Хороший BHA (2%, работает). ✅ Мягкие ПАВ + мощное очищение. ⚠️ pH ~3.5-4.0 может стянуть сухую кожу. 📌 ВЕРДИКТ: Хороший выбор для жирной кожи, новичков с BHA."
product_054,Blemish Control,Гельтек,1145,мидл,Анти-акне сыворотка,"Purified water, butylene glycol, encapsulated salicylic acid, pentylene glycol, glycerol, ethoxydiglycol, mandelic acid, propylene glycol, d-panthenol, licorice root extract, green tea extract, allantoin, 1,2-hexanediol, caprylyl glycol","Анти-акне (BHA + AHA комбинация), пилинг (мягкий двойной), противовоспаление, успокаивание",~4.0-4.5 (благодаря буферизации),"Mandelic Acid + Salicylic Acid (могут раздражать), Propylene Glycol, Ethoxydiglycol","✅ ИННОВАТИВНО: Инкапсулированная BHA (более безопасна при нанесении). ✅ BHA + AHA (двойной пилинг, но мягкий). ✅ Успокаивающие компоненты. 📌 ВЕРДИКТ: TOP для акне (двойной пилинг, но буферизирован)."
product_055,Madagascar Centella Ampoule,Skin 1004,1310,мидл,Успокаивающая сыворотка,"Water, Glycerin, Butylene Glycol, Centella Asiatica Extract (30,000 ppm), 1,2-Hexanediol, Cellulose Gum, Ethylhexylglycerin","Успокаивание, заживление, гидратация, противовоспаление",~5.5-6.0 (нейтральный),"Ethylhexylglycerin, отсутствуют типичные раздражители","✅ ОЧЕНЬ ВЫСОКАЯ КОНЦЕНТРАЦИЯ Centella (3%! редко встречается). ✅ Простой, честный состав. ⚠️ ТОЛЬКО успокаивание (нет активных пилингов/витаминов). 📌 ВЕРДИКТ: TOP для sensitive/воспаленной кожи."
product_056,Ampoule Real Active Panthenol Plus,NEEDLY,1573,мидл,Увлажняющая сыворотка с пантенолом,"Water, Panthenol, Dipropylene Glycol, Niacinamide, Allantoin, Caprylyl Glycol, 1,2-Hexanediol, Propanediol, Illicium Verum (Anise) Fruit Extract, Betaine, Trehalose, Tromethamine, Butylene Glycol, Sodium Hyaluronate, Hippophae Rhamnoides Fruit Extract, C12-14 Pareth-12, Carbomer, Cetyl Ethylhexanoate, Caprylyl Glycol, Ethylhexylglycerin, Adenosine, Disodium EDTA, Xanthan Gum, Citrus Aurantium Bergamia (Bergamot) Fruit Oil, Linalool, Limonene","Глубокая гидратация, успокаивание, восстановление барьера, антиоксидация",~5.5-6.0 (благодаря pH-буферизации Tromethamine),"🚨 ФОТОТОКСИЧНЫЕ МАСЛА (Citrus Aurantium Bergamia, Linalool, Limonene), Ethylhexylglycerin, Pareth-12","✅ ОЧЕНЬ ВЫСОКАЯ концентрация Panthenol (10-15%!). ✅ Хороший состав (успокаивание + гидратация). 🚨 ФОТОТОКСИЧНЫЕ МАСЛА — ❌ ТОЛЬКО ночь! 📌 ВЕРДИКТ: TOP для гидратации/успокаивания, но только ночь."
product_057,Snail 96,COSRX,1792,мидл,Эссенция (гиалуронат + улитка),"Snail Secretion Filtrate, Betaine, Butylene Glycol, 1,2-Hexanediol, Sodium Hyaluronate, Panthenol, Arginine, Allantoin, Ethyl Hexanediol, Sodium Polyacrylate, Carbomer, Phenoxyethanol","Гидратация, заживление, гладкость (улиточный фильтрат богат гликозаминогликанами)",~5.5-6.0 (нейтральный),"Phenoxyethanol, отсутствуют типичные раздражители","✅ КЛАССИЧЕСКИЙ K-beauty продукт. ✅ Высокая концентрация улиточного фильтрата (96%!). ✅ Хороший ratio цена/объём (100мл!). ❌ НЕ веган (животная слизь улитки). 📌 ВЕРДИКТ: TOP для гидратации, но не веган. Классик жанра."
product_058,Vital Crithmum Anti-Age Essence,LIMONI,1742,мидл,Антивозрастная эссенция,"Water, glycerin, dipropylene glycol, caprylic/capric triglyceride, propanediol, dimethicone, betaine, niacinamide, propylene glycol dicaprylate/dicaprate, cetearyl olivate, sorbitan olivate, phenoxyethanol, cetearyl alcohol, glyceryl stearate, peg-100 stearate, xanthan gum, hydroxyethyl acrylate/sodium acryloyldimethyl taurate copolymer, sodium acrylate/sodium acryloyldimethyl taurate copolymer, hydrogenated lecithin, cyclopentasiloxane, fragrance, cyclotetrasiloxane, ethylhexylglycerin, isohexadecane, glyceryl acrylate/acrylic acid copolymer, adenosine, dimethiconol, polysorbate 80, disodium edta, polysorbate 60, sorbitan isostearate, sorbitan oleate, crithmum maritimum callus culture filtrate, fructan, 1,2-hexanediol, disodium phosphate, tocopherol, sodium phosphate, caprylyl glycol, acetyl hexapeptide-8","Анти-эйджинг, разглаживание морщин (пептиды), гидратация, антиоксидация","~5.5-6.0 (нейтральный, но Dimethicone + силиконы)","Dimethicone (силикон, может оставить пленку), Cyclopentasiloxane + Cyclotetrasiloxane (силиконы много!), Phenoxyethanol + Ethylhexylglycerin, Fragrance","⚠️ МНОГО СИЛИКОНОВ (3 вида). ✅ Acetyl Hexapeptide-8 (работает против мимических морщин). ✅ Нияцинамид + Tocopherol. 🚨 Критмум = маркетинг (микроконцентрация). 📌 ВЕРДИКТ: Хорош для анти-эйджа, но силиконы могут быть проблемой."
product_059,Anti-Pigment,Eucerin,2410,мидл,Анти-пигментация сыворотка,"Aqua, Alcohol Denat., Butylene Glycol, Glycerin, Octocrylene, Isopropyl Palmitate, Cetearyl Isononanoate, Distarch Phosphate, Methylpropanediol, Isobutylamido Thiazolyl Resorcinol, Sodium Ascorbyl Phosphate, Sodium Hyaluronate, Glycyrrhiza Inflata Root Extract, Tocopherol, Glucosylrutin, Sodium Stearoyl Glutamate, Glyceryl Stearate, Sodium Polyacrylate, Dimethicone, Isoquercitrin, Citric Acid, Sodium Chloride, Trisodium EDTA, Caprylyl Glycol, Phenoxyethanol, Parfum","Осветление пигментации, антиоксидация, гидратация, разглаживание",~3.5-4.0 (из-за Citric Acid),"Isobutylamido Thiazolyl Resorcinol (может раздражать), Alcohol Denat. (спирт, может раздражать), Phenoxyethanol, Octocrylene (УФ-фильтр, может раздражать)","✅ СПЕЦИАЛЬНЫЙ КОМПОНЕНТ: Isobutylamido Thiazolyl Resorcinol (редко встречается, работает на пигментацию!). ✅ Стабилизированный витамин C. 🚨 ОЧЕНЬ ДОРОГО (80.33₽/мл). ⚠️ Alcohol Denat. может раздражать. 📌 ВЕРДИКТ: TOP для пигментации, но люкс-цена."
product_060,Skin Chemistry Bifida Barrier,MIXIT,443,бюджет,Восстанавливающая сыворотка,"Aqua, C12-15 Alkyl Benzoate, Glyceryl Stearate, Ethoxydiglycol, Bifida Ferment Lysate, Lactobacillus Ferment Lysate, Niacinamide, Propylene Glycol, Linoleic Acid, Panthenol, Linolenic Acid, Bisabolol, Tocopheryl Acetate, Aesculus Hippocastanum Fruit Extract, Xanthan Gum, Phospholipids, Sphingolipids, Ceteareth-20, Ceteareth-12, Cetearyl Alcohol, Cetyl Palmitate, Phenoxyethanol, Ethylhexylglycerin, Chlorphenesin, Benzophenone-4, Arginine, Parfum, Benzyl Alcohol, Sodium Benzoate, Potassium Sorbate, Disodium EDTA, CI 16035","Восстановление барьера (пробиотики + липиды), гидратация, успокаивание, противовоспаление",~5.5-6.0 (нейтральный),"Benzophenone-4 (УФ-фильтр, может раздражать), Ethylhexylglycerin + Phenoxyethanol (двойная консервация), Chlorphenesin, CI 16035 (синтетический краситель)",✅ ОТЛИЧНОЕ СООТНОШЕНИЕ ЦЕНА/КАЧЕСТВО (14.77₽/мл за пробиотики + липиды!). ✅ Двойной пробиотик-лизат (редко). ✅ Омега-масла. ⚠️ Benzophenone-4 + много консервантов. 📌 ВЕРДИКТ: TOP для восстановления барьера при дешевой цене.
product_061,Arginine 2.7%,TRUE ALCHEMY,534,бюджет,Сыворотка с аргинином,"Aqua, Aloe Barbadensis Leaf Juice, Glycerin, Arginine, Pentylene Glycol, Hydrolyzed Soy Protein, Sodium Hyaluronate, Benzyl Alcohol, Xanthan Gum, Citric Acid, Polygonum Fagopyrum Seed Extract, Ginkgo Biloba Leaf Extract, Sorbus Aucuparia Fruit Extract, Benzoic Acid, Lactic Acid","Синтез коллагена (аргинин), гидратация, антиоксидация, успокаивание, питание",~5.0-5.5 (благодаря Citric Acid),"Benzoic Acid (консервант), Lactic Acid (может раздражать), Benzyl Alcohol","✅ БЮДЖЕТНАЯ цена за аргинин. ✅ Простой состав. ⚠️ Аргинин (2.7%) может работать, но концентрация не очень высокая для синтеза коллагена. 📌 ВЕРДИКТ: Бюджетный вариант для anti-age, но есть лучше."
product_062,Lactic Acid 9% + LHA,TRUE ALCHEMY,707,бюджет,Пилинг-сыворотка,"Aqua, Aloe Barbadensis Leaf Juice, Lactic Acid, Glycerin, Pentylene Glycol, Xanthan Gum, Benzyl Alcohol, Sodium Hyaluronate, Cucumis Sativus L. Extract, Avena Sativa L. Extract, Tilia Cordata Mill. Extract, Pinus Sibirica Seed Oil","Пилинг (AHA + LHA комбинация, мягкий), гидратация, успокаивание (алоэ)",~3.0-3.5 (из-за Lactic Acid),"Lactic Acid (может раздражать), Benzyl Alcohol, отсутствуют типичные раздражители","✅ LHA (лип-гидрокси кислота, редко встречается, работает в порах!). ✅ Лактическая кислота 9% (хорошая концентрация). ✅ Алоэ (успокаивает). 📌 ВЕРДИКТ: TOP пилинг-сыворотка за цену."
product_063,Vitamin C 13%,TRUE ALCHEMY,1153,мидл,Осветляющая сыворотка,"Aqua, Ascorbyl Glucoside, Glycerin, Pentylene Glycol, Betaine, Xanthan Gum, Benzyl Alcohol, Prunus Amygdalus Dulcis Oil, Sodium Hyaluronate, Fagopyrum P. Mill. Extract, Hippophae Rhamnoides Fruit Oil, Inonotus Obliquus Extract","Осветление, антиоксидация, питание, гидратация",~5.5-6.0 (нейтральный),"Benzyl Alcohol, отсутствуют типичные раздражители","✅ Стабилизированный витамин C (Ascorbyl Glucoside, безопаснее L-аскорбиновой). ✅ Питающие масла. ✅ Чага (антиоксидант). ⚠️ ДОРОГО (38.43₽/мл). 📌 ВЕРДИКТ: TOP для осветления + питания, стабилизированный витамин C."
