product_id,name,brand,price_rub,segment,category,ingredients_raw,functional_category,pH,allergens,issues
product_033,Тоник обновляющий (Сибирские эндемики),Siberian Health,520,бюджет,Пилинг-тоник (мягкий BHA),"Aqua, Aloe Barbadensis Leaf Juice, Salvia Officinalis Leaf Water, Thymus Vulgaris Leaf Water, Pentylene Glycol, Betaine, Salicylic Acid, Niacinamide, Lippia Citriodora Leaf Water, Arginine, Lactobacillus/Soymilk Ferment Filtrate, Lactobacillus/Rye Flour Ferment, Bacillus/Soybean Ferment Extract, Benzyl Alcohol, Acrylic Polymer, Glycerin, Propanediol, 1,2-Hexanediol, Eleutherococcus Senticosus Root Extract, Rhaponticum Carthamoides Root Extract, Scutellaria Baicalensis Extract, Rhododendron Adamsii Extract, Rhodiola Quadrifida Extract, Benzoic Acid, Dehydroacetic Acid, Potassium Sorbate, Sodium Benzoate, Citric Acid","Пилинг (мягкий BHA), гидратация, успокаивание, противовоспаление, пребиотический комплекс",~5.0-5.5 (благодаря буферизации Citric Acid),"Benzyl Alcohol (консервант), Benzoic Acid + Dehydroacetic Acid (двойная консервация), растительные экстракты (редко), Parfum отсутствует (хорошо!)","✅ МЯГКИЙ BHA (0.5-1%, хороший для новичков). ✅ Ферментированные комплексы (редко встречаются). ✅ Гидролаты (Шалфей, Тимьян работают). ✅ NO Fragrance (отличный выбор). ✅ Цена хорошая (2.60₽/мл). ⚠️ Двойная консервация (Benzyl Alcohol + Benzoic + Dehydroacetic). ⚠️ Novichkam OK, но консерванты могут раздражать very sensitive. 📌 ВЕРДИКТ: ОТЛИЧНЫЙ выбор для новичков с BHA! Мягче, чем другие. Лучший для sensitive."
product_034,MOISTURIZER RICH,Don't Touch My Skin,2371,мидл,Питающий ночной крем,"Aqua, Hydrogenated Polyisobutene, Simmondsia Chinensis (Jojoba) Seed Oil, Glyceryl Stearate, Lactococcus Ferment Lysate, Glycerin, Cetearyl Glucoside/Cetearyl Alcohol, Alkyl Malate, Polydimethylsiloxane, Alkyl Lactate, Niacinamide, Cyclopentasiloxane/Dimethicone/Vinyl Dimethicone Crosspolymer, Ammonium Acryloyldimethyltaurate/VP Copolymer, Cetearyl Alcohol/Potassium Cetyl Phosphate, Squalane, Aloe Barbadensis Leaf Gel, Panthenol, Urea, Ethylhexyl Palmitate / Silica Dimethyl Silylate / Butylene Glycol / Pentylene Glycol / Sodium Hyaluronate, Sodium L-Pyrrolidone Carboxylate / Sodium Lactate / L-Arginine / L-Aspartic Acid / L-Pyrrolidone Carboxylic Acid / Glycine / L-Alanine / L-serine / L-Valine / L-Proline / L-Threonine / L-Isoleucine / L-Histidine / L-Phenylalanine / Aqua, Synthetic Beeswax, Tocopherol, Linoleic Acid/Linolenic Acid, Phenoxyethanol/Methylparaben/Ethylparaben/Propylparaben, Sodium Hyaluronate, Hydrogenated Lecithin, Ascorbyl Glucoside, Bis-Ethylhexyl Hydroxydimethoxy Benzylmalonate, Succinic Acid, Isoquercetin","Ночной питающий крем, восстановление барьера, гидратация, пробиотический комплекс","~5.5-6.0 (нейтральный, буфер отсутствует видимо)","Парабены (Methylparaben + Ethylparaben + Propylparaben, 3 консерванта!), Phenoxyethanol, Fragrance отсутствует (хорошо), Silicones (Dimethicone, Cyclopentasiloxane)","✅ ОТЛИЧНАЯ ЛИПИДНАЯ СИСТЕМА (Jojoba + Squalane + Lecithin + Potassium Cetyl Phosphate). ✅ Пробиотик-лизат (редко встречается). ✅ Аминокислотный комплекс (восстановление). ⚠️ ПАРАБЕНЫ (3 вида!) — старая, спорная консервная система. ⚠️ Силиконы (много) — могут оставить пленку на коже, затруднят очищение. ⚠️ САМАЯ ДОРОГАЯ (47.42₽/мл за 50мл). 📌 ВЕРДИКТ: Хороший состав (липиды, пробиотики), но парабены и силиконы спорны. Для ночи OK, но есть лучше без парабенов."
product_035,Mineral 89,VICHY,2226,мидл,Легкий увлажняющий крем,"Aqua, Glycerin, Dicaprylyl Ether, Pentylene Glycol, Polyglyceryl-6 Distearate, Niacinamide, Propanediol, Cetyl Esters, Jojoba Esters, Cetearyl Isononanoate, Squalane, Behenyl Alcohol, Adenosine, Capryloyl Salicylic Acid, Hydroxyacetophenone, Mineral Salts, Sodium Hyaluronate, Trisodium Ethylenediamine Disuccinate, Vitreoscilla Ferment, Tocopherol, Acacia Decurrens Flower Cera, Acrylamide/Sodium Acryloyldimethyltaurate Copolymer, Cetyl Alcohol, Helianthus Annuus Seed Cera, Hydroxypropyl Starch Phosphate, Isohexadecane, Polyglycerin-3, Polyglyceryl-3 Beeswax, Polysorbate 80, Sodium Stearoyl Glutamate, Sorbitan Oleate, Parfum","Легкий дневной увлажняющий крем, мягкий себоконтроль (BHA), гидратация, себорегуляция",~5.5-6.0 (нейтральный),"Capryloyl Salicylic Acid (BHA, раздражитель), Fragrance, Polysorbate 80 (может раздражать), Beeswax (животное), Acrylamide (спорный консервант)","✅ ИННОВАТИВНО: BHA (Capryloyl Salicylic Acid) в КРЕМЕ! Обычно BHA в тониках/пилингах, редко в кремах. ⚠️ BHA в креме может быть раздражающим при ежедневном использовании. ✅ Нияцинамид (себорегуляция). ✅ Пребиотики (Vitreoscilla). ⚠️ Fragrance, Polysorbate 80 могут раздражать. ⚠️ Не веган (Beeswax). 📌 ВЕРДИКТ: Инновативно, но BHA в креме — нишевой вариант. Для жирной кожи с опытом. Не для чувствительной."
product_036,Sebium Sensitive,Bioderma,1679,мидл,Легкий крем для жирной sensitive,"Aqua/Water/eau, Glycerin, Methyl Methacrylate Crosspolymer, Dipropylene Glycol, Zinc Gluconate, Coco-Caprylate/Caprate, Vinyl Dimethicone/Methicone, Silsesquioxane Crosspolymer, Caprylic/Capric Triglyceride, Arachidyl Alcohol, Behenyl Alcohol, Polyacrylate Crosspolymer-6, Sodium Polyacrylate, Glycyrrhetinic Acid, Propylene Glycol, Arachidyl Glucoside, Bakuchiol, Laminaria Ochroleuca Extract, Mannitol, Xylitol, Sodium Metabisulfite, Rhamnose, Ginkgo Biloba Leaf Extract, Tocopherol, Fructooligosaccharides, Fragrance (Parfum)","Легкий крем для жирной sensitive кожи, себорегуляция, противовоспаление, ретинизирующий (мягкий), пребиотический комплекс",~5.5-6.0 (нейтральный),"Vinyl Dimethicone (силикон), Fragrance, консервантов минимум, Sodium Metabisulfite (может раздражать при sensitivity)","✅ BAKUCHIOL! (ретинол-подобный, без раздражения, отличный!) ✅ Пребиотический комплекс (восстанавливает микробиом). ✅ Себорегуляция (Zinc) для жирной. ✅ Легкая текстура (для жирной sensitive). ⚠️ Силикон (Vinyl Dimethicone, может оставить пленку). ⚠️ Sodium Metabisulfite (может раздражать sensitive). ⚠️ ДОРОГО (55.97₽/мл за 30мл, это люкс в люксе). 📌 ВЕРДИКТ: TOP для жирной sensitive с опытом. Bakuchiol — редкий компонент (обычно в люкс-сегменте). Рекомендовать!"
product_037,Keep Calm Cream,THE U,516,бюджет,Успокаивающий крем,"Purified water, glycerin, glyceryl stearate SE, triheptanoin, dicapryl carbonate, fructooligosaccharides, avocado oil, sweet almond oil, caprylic/capric triglycerides, cetearyl alcohol, squalane, centella asiatica extract, kelp extract, propylene glycol, sodium acrylate/sodium acryloyl dimethyltaurate copolymer, caprylhydroxamic acid, perfume, sodium stearoyl lactylate, citric acid, xanthan gum, glyceryl caprylate, potassium sorbate, sodium benzoate","Успокаивающий, питающий крем, для раздраженной/воспаленной кожи, пребиотический",~5.0-5.5 (благодаря Citric Acid),"Fragrance, Propylene Glycol, Sodium Acrylate (консервант), Caprylhydroxamic Acid (консервант, может раздражать)","✅ CENTELLA ASIATICA (мощная концентрация, успокаивает!). ✅ Пребиотики + питающие масла (Avocado + Almond). ✅ pH правильный (5.0-5.5). ✅ Простой, честный состав (нет парабенов). ⚠️ Fragrance (неизвестный состав). ⚠️ Sodium Acrylate + Caprylhydroxamic Acid (консерванты, могут раздражать). 📌 ВЕРДИКТ: ХОРОШИЙ выбор для раздраженной/воспаленной кожи. Centella в высокой концентрации — редко встречается в кремах. Рекомендовать!"
product_038,NMF Protection,Гельтек,1049,мидл,Восстанавливающий крем,"Вода Очищенная, Изононил Изононаноат, Глицерин, Каприлик/каприк Триглицерид, Глицерил Стеарат Цитрат, Масло Ши, Гидроксиэтил Мочевина, Бетаин, Сквалан, Алюминия Крахмал Октенилсукцинат, Натрий Pca, Сорбитол, Серин, Глицин, Глутаминовая Кислота, Аланин, Лизин, Аргинин, Треонин, Пролин, Гексилдеканол, Бисаболол, Цетилгидроксипролин Пальмитамид, Стеариновая Кислота, Фитостеролы Рапсового Масла, С12-16 Высшие Жирные Спирты, Пальмитиновая Кислота, Гидрогенизированный Лецитин, Цетеариловый Спирт, Витамин Е(токоферил Ацетат) Акрилат Натрия, Натрия Акрилоилдиметилтаурата Сополимер, Дисодиум Эдта, Гидроксиацетофенон, 1,2- Гександиол, Каприлилгликоль, Отдушка","Восстановление барьера (NMF система + липиды), глубокая гидратация, успокаивание","~6.0-6.5 (нейтральный, буфер видимо в Glyceryl Stearate Citrate)","Консервантов нет видимо (или Hydroxyacetophenone минимально), Fragrance, Paraben отсутствуют (хорошо!)","✅ ОТЛИЧНАЯ NMF-СИСТЕМА (9 аминокислот восстанавливают натуральный увлажнитель кожи!). ✅ Липидная триада (Shea, Squalan, Lecithin, Plant Sterols). ✅ Нет парабенов. ✅ Цена разумна (34.97₽/мл за 30мл). ✅ Для поврежденного/сухого барьера — отличный выбор. ⚠️ Fragrance (неизвестный состав). ⚠️ Маленький формат (30мл, быстро закончится). 📌 ВЕРДИКТ: РЕКОМЕНДОВАТЬ! TOP для восстановления барьера. NMF система редко встречается. Честный состав."
product_039,Niacinamide mask,LABORATORIUM,351,бюджет,Маска питающая,"Вода, рапсовое масло, стеариновая кислота, цетеарил оливат, сорбитан оливат, глицерин, пентиленгликоль, гидролизованные протеины пшеницы, ниацинамид, каприлик/каприк триглицериды, трегалоза, инулин, гиалуронат натрия, L-аргинин, бензиловый спирт","Питание, гидратация, восстановление, пребиотический уход",~5.5-6.0 (благодаря масляной основе + буферизации),"Бензиловый спирт (консервант, может раздражать), рапсовое масло (может быть аллергеном)","✅ Маслянистая основа (питание). ✅ Протеины + пребиотики. ✅ Ниацинамид (себорегуляция). ⚠️ ОЧЕНЬ МАЛЕНЬКИЙ ФОРМАТ (20мл! На 1-2 применения). ⚠️ Бензиловый спирт может раздражать. 🚨 ДОРОГО за объём (17.55₽/мл за микроформат). 📌 ВЕРДИКТ: Хорошая маска по составу, но формат маркетинговый (пробник)."
product_040,Bifida Biome Deep Sleeping Mask,Ma:nyo,3667,люкс,Ночная маска (биопробиотики + PHA),"Water, bifida ferment lysate, glycerin, butylene glycol, caprylic/capric triglyceride, cetyl ethylhexanoate, methylpropanediol, niacinamide, 1,2-hexanediol, centella asiatica extract, oenothera biennis (evening primrose) flower extract, chamomilla recutita (matricaria) flower extract, hamamelis virginiana (witch hazel) water, borago officinalis extract, centaurea cyanus flower extract, sodium hyaluronate, hyacinthus orientalis (hyacinth) extract, lavandula angustifolia (lavender) flower extract, salvia sclarea (clary) extract, dextrin, hydrogenated lecithin, dipropylene glycol, ceramide np, cholesterol, capryloyl salicylic acid, gluconolactone, theobroma cacao (cocoa) extract, inulin, xanthan gum, cellulose, fructose, glucose, polyglyceryl-3 methylglucose distearate, sodium acrylate/sodium acryloyldimethyl taurate copolymer, polyisobutene, carbomer, polyglyceryl-2 stearate, hydroxyethyl acrylate/sodium acryloyldimethyl taurate copolymer, sorbitan isostearate, adenosine, lactobacillus ferment lysate, lactobacillus/milk ferment filtrate, lactococcus ferment lysate, saccharomyces ferment lysate filtrate, streptococcus thermophilus ferment, arginine, glyceryl stearate, stearyl alcohol, ethylhexylglycerin, caprylyl/capryl glucoside, sorbitan oleate, cellulose gum, disodium edta","Ночная маска, пробиотический уход (микробиом), мягкий пилинг (BHA+PHA), восстановление барьера, антиоксидация",~5.0-5.5 (благодаря буферизации PHA + BHA),"Ethylhexylglycerin (консервант, может раздражать), Lavender Oil (фототоксичен, но это ночная маска), множество растительных экстрактов (редко аллергия)",✅ ОТЛИЧНЫЙ СОСТАВ: 5 видов пробиотик-лизатов (редко встречается!). ✅ BHA+PHA комбинация (мягкий двойной пилинг в маске!). ✅ Керамиды (восстановление). ✅ Centella (успокаивает). 🚨 ОЧЕНЬ ИННОВАТИВНО: Пробиотики + пилинг в ночной маске = редкая комбинация. ⚠️ ДОРОГО (36.67₽/мл). ⚠️ Ethylhexylglycerin может раздражать. 📌 ВЕРДИКТ: TOP для любителей инноваций. Хороша для восстановления микробиома + мягкого пилинга.
product_041,Vitamin Tree Brightening Pack,Ma:nyo,2069,мидл,Ночная маска (осветление),"Hippophae rhamnoides water, glycerin, citrus limon (lemon) fruit water, citrus junos fruit extract, niacinamide, propylene glycol dicaprylate, physalis alkekengi fruit extract, terminalia ferdinandiana fruit extract, propolis extract, 1,2-hexanediol, rosa canina fruit oil, sclerotium gum, distarch phosphate, betaine, xanthan gum, citrus aurantium dulcis (orange) oil, cetearyl olivate, myrciaria dubia fruit extract, honey, honey extract, phaseolus radiatus seed extract, lactic acid, royal jelly extract, rosa canina fruit extract, glycyrrhiza glabra (licorice) root extract, euterpe oleracea fruit extract, ethylhexylglycerin, cetearyl alcohol, sorbitan olivate, arachidyl alcohol, tocopherol, helianthus annuus (sunflower) seed oil, litsea cubeba fruit oil, behenyl alcohol, cetearyl glucoside, arachidyl glucoside, hippophae rhamnoides oil, limonene, citral","Ночная маска, осветление (витамин C + лактическая кислота), антиоксидация, питание",~4.0-4.5 (из-за лактической кислоты + цитрусовых кислот),"🚨 МНОЖЕСТВЕННЫЕ ФОТОТОКСИЧНЫЕ МАСЛА (Citrus Limon, Citrus Aurantium, Litsea Cubeba, Rose Hip Oil, Limonene, Citral)","✅ ОТЛИЧНЫЙ СОСТАВ для осветления: облепиховая вода (витамины), лактическая кислота, Propolis. ✅ Ночная маска (фототоксины не критичны). 🚨 КРИТИЧНО: Множественные ФОТОТОКСИЧНЫЕ МАСЛА (лимон, апельсин, лицея) — ❌ НЕ для дневного использования! ⚠️ НЕ веган (мёд, Royal Jelly). ⚠️ Acidic (~4.0-4.5) может раздражать sensitive при регулярном использовании. 📌 ВЕРДИКТ: TOP для ночного осветления (витамин C + лактическая кислота + Propolis). Но только вечер!"
product_042,Mugwort Calming Soothing гель,Round Lab,1092,мидл,Успокаивающий гель (не маска),"Aqua, Butylene Glycol, Dipropylene Glycol, Propanediol, Glycerin, 1,2-Hexanediol, Betaine, Polyglyceryl-10 Laurate, Ammonium Acryloyldimethyltaurate/VP Copolymer, Acrylates/C10-30 Alkyl Acrylate Crosspolymer, Tromethamine, Ethylhexylglycerin, Artemisia Princeps Leaf Extract, Disodium EDTA, Decyl Glucoside, Panthenol, Allantoin, Melia Azadirachta Leaf Extract, Camellia Sinensis Leaf Extract, Salvia Officinalis Oil, Melia Azadirachta Flower Extract, Salix Alba Bark Extract, Centella Asiatica Leaf Extract, Cladosiphon Okamuranus Extract, Coffea Arabica Seed Extract, Citrus Aurantium Bergamia Leaf Extract, Pinus Densiflora Leaf Extract, Portulaca Oleracea Extract, Centella Asiatica Extract, Tocopherol, Artemisia Vulgaris Extract, Madecassoside, Madecassic Acid, Asiaticoside, Asiatic Acid","Успокаивающий гель для чувствительной кожи, противовоспаление, гидратация",~5.5-6.0 (благодаря pH-буферизации Tromethamine),"Ethylhexylglycerin (консервант), Salvia Officinalis Oil (может быть раздражителем), Citrus Aurantium Bergamia (фототоксичен, но концентрация низкая)","✅ ОТЛИЧНЫЙ для sensitive: Artemisia + Centella + Panthenol. ✅ pH буферизирован (Tromethamine). ✅ Множество успокаивающих компонентов. ⚠️ Ethylhexylglycerin может раздражать. ⚠️ Salvia Oil может быть раздражителем (эфирное масло). 📌 ВЕРДИКТ: TOP для sensitive, воспаленной кожи. Хороший выбор (7.28₽/мл)."
product_043,Birch juice moisturizing toner,Round Lab,1446,мидл,Тонер увлажняющий (с витамином C),"Water, Glycerin, Propanediol, Glycereth-26, Pentylene Glycol, Betula Platyphylla Japonica Juice, 1,2-Hexanediol, Chondrus Crispus Extract, Saccharum Officinarum (Sugarcane) Extract, Sodium Hyaluronate, Hyaluronic Acid, Panthenol, Tromethamine, Dipotassium Glycyrrhizate, Glyceryl Caprylate, Glyceryl Glucoside, Butylene Glycol, Ascorbic Acid, Carbomer, Xanthan Gum, Disodium EDTA","Тонер увлажняющий, осветление (витамин C), гидратация, успокаивание",~5.0-5.5 (благодаря pH-буферизации Tromethamine),"Ascorbic Acid (витамин C может раздражать, но pH буферизирован), Ethylhexylglycerin, Carbomer (полимер может раздражать)","✅ ОТЛИЧНЫЙ состав: Betula Juice (натуральный витамин C источник!), Ascorbic Acid (стабилизирован pH), гиалуронаты, солодка. ✅ pH правильный (5.0-5.5). ✅ Большой объём (300мл) за разумную цену. ⚠️ Ascorbic Acid + витамин C комбо (может быть избыточной концентрацией). 📌 ВЕРДИКТ: TOP для гидратации + мягкого осветления. Лучше, чем многие серумы с витамином C."
product_044,1025 Dokdo Bubble Cleansing Foam,Round Lab,1237,мидл,Пенка для очищения (мягкий BHA),"Aqua, Disodium Cocoyl Glutamate, Glycerin, Coco-Glucoside, Disodium Cocoamphodiacetate, Lauryl Glucoside, Methylpropanediol, Butylene Glycol, Sodium Chloride, Caprylyl Glycol, Ethoxydiglycol, Glyceryl Caprylate, Salicylic Acid, Citric Acid, Polyglyceryl-10 Myristate, Sodium Citrate, Dipropylene Glycol, 2,3-Butanediol, Polyglyceryl-10 Laurate, Sea Water, Sodium Cocoyl Isethionate, Glycereth-26, Propanediol, 1,2-Hexanediol, Sodium Phytate, Decyl Glucoside, Quillaja Saponaria Bark Extract, Camellia Sinensis Leaf Extract, Centella Asiatica Leaf Extract, Cladosiphon Okamuranus Extract, Salix Alba Bark Extract, Coffea Arabica Seed Extract, Citrus Aurantium Bergamia Leaf Extract, Allantoin, Dipotassium Glycyrrhizate, Panthenol, Pinus Densiflora Leaf Extract, Hyaluronic Acid, Ethylhexylglycerin, Hydrolyzed Hyaluronic Acid, Sodium Hyaluronate","Очищение (мягкие ПАВ + мягкий BHA), гидратация, успокаивание","~3.5-4.0 (идеально для BHA, благодаря Citric Acid + Sodium Citrate)","Salicylic Acid (может раздражать, но концентрация низкая), Ethylhexylglycerin, Citrus Aurantium Bergamia (фототоксичен, но концентрация низкая)","✅ ОТЛИЧНЫЙ СОСТАВ: 5 мягких ПАВ (редко встречается!). ✅ pH идеален для BHA (3.5-4.0). ✅ Мягкий BHA для новичков. ✅ Sea Water (минералы, тонизирующее). ✅ Гиалуронаты + успокаивающие экстракты (хорошая комбинация). ⚠️ Ethylhexylglycerin. 📌 ВЕРДИКТ: TOP для новичков с BHA + гидратацией. Лучше, чем COSRX (7.24₽/мл), потому что 5 ПАВ + гиалуронаты."
product_045,1025 Dokdo Cream,Round Lab,1601,мидл,Дневной/ночной крем с керамидами,"Water, Glycerin, Caprylic/Capric Triglyceride, Dipropylene Glycol, Hydrogenated Poly(C6-14 Olefin), Cetearyl Alcohol, Methyl Trimethicone, 1,2-Hexanediol, Caprylyl Methicone, Phenyl Trimethicone, C12-16 Alcohols, Butyrospermum Parkii (Shea) Butter, Glyceryl Stearate SE, Polymethylsilsesquioxane, Cetearyl Glucoside, Palmitic Acid, Cetearyl Olivate, Sorbitan Olivate, Hydrogenated Lecithin, Ammonium Acryloyldimethyltaurate/VP Copolymer, Copernicia Cerifera (Carnauba) Wax, Ethylhexylglycerin, Glyceryl Caprylate, Stearic Acid, Disodium EDTA, Sea Water, Allantoin, Panthenol, Butylene Glycol, Chondrus Crispus Extract, Beta-Glucan, Saccharum Officinarum (Sugarcane) Extract, Ceramide AP, Ceramide AS, Ceramide EOP, Ceramide NP, Ceramide NS, Cholesterol, Phytosphingosine, Hyaluronic Acid, Hydrolyzed Hyaluronic Acid, Sodium Hyaluronate","Дневной/ночной крем, восстановление барьера (керамидная триада!), гидратация (гиалуронаты), питание (Shea Butter)",~6.0-6.5 (нейтральный),"Methyl Trimethicone + Caprylyl Methicone + Phenyl Trimethicone (силиконы, много!), Ethylhexylglycerin, Carnauba Wax (может быть раздражителем)","✅ ОТЛИЧНЫЙ состав: Керамидная ПЕНТАДА (5 керамидов! редко встречается), Cholesterol + Phytosphingosine (идеальная липидная триада). ✅ Гиалуронаты в трех формах. ✅ Шея масло (питание). ⚠️ МНОГО СИЛИКОНОВ (3 вида Trimethicone + Polymethylsilsesquioxane) — могут оставить пленку на коже. 🚨 ДОРОГО (20.01₽/мл за 80мл). 📌 ВЕРДИКТ: TOP для восстановления барьера (керамидная пентада редкость!), но силиконы могут быть проблемой для очень чувствительной кожи."
